<?xml version="1.0" encoding="UTF-8"?>
<book xmlns:xsi="http://www.w3.org/2001/XMLSchema-instance"
 xsi:noNamespaceSchemaLocation="xsd/book-schema-draft.xsd">
    <metadata>
        <isbn>1234567890</isbn>
        <edition>0</edition>
        <title>title0</title>
        <author>
            <first-name>first-name0</first-name>
            <surname>surname0</surname>
        </author>
        <author>
            <first-name>first-name1</first-name>
            <surname>surname1</surname>
        </author>
    </metadata>
    <section>
        <para>
        </para>
        <para>
        </para>
    </section>
    <section>
        <para>
        </para>
        <para>
        </para>
    </section>
</book>
